"78SK2UBH","journalArticle","2019","Kranzler, C. F.","Silicon limitation facilitates virus infection and mortality of marine diatoms","Nature Microbiology","","","","","Diatoms are among the most globally distributed and ecologically successful organisms in the modern ocean, contributing upwards of 40% of total marine primary productivity1,2. By  converting dissolved silicon into biogenic silica, and photosynthetically  fixing carbon dioxide into particulate organic carbon, diatoms effectively couple the silicon (Si) and carboncycles and ballast substantial vertical flux of carbon out of the euphotic zone into the mesopelagic and deep ocean3–5. Viruses are key players in ocean biogeochemical cycles6,7, yet little is known about how viral infection specifically impacts diatom populations. Here, we show that Si limitation facilitates virus infection and mortality in diatoms in the highly productive coastal waters of the California Current Ecosystem. Using metatranscriptomic analysis of cell-associated diatom viruses and targeted quantification of extracellular viruses, we found a link between Si stress and the early, active and lytic stages of viral infection. This relationship was also observed in cultures of the bloom-forming diatom Chaetoceros tenuissimus, where Si stress accelerated virus-induced mortality. Together, these findings contextualize viruses within the ecophysiological framework of Si availability and diatom-mediated biogeochemical cycling.","2019","2022-12-16 19:26:41","2022-12-16T19:26:41Z","","1790-1797","","","4","","","","","","","","","","","","","","","","","Accession Number: CCE LTER Contribution #0454; AR2020 Type: 10.1038/s41564-019-0502-x","","","","CCE; Published","","","","","","","","","","","","","","","","","","","","","","","","","","","","","","","","","","","","","","","","","","","","","","",""
"5NMFX3GP","journalArticle","2019","Kelly, T. B.","The importance of mesozooplankton diel vertical migration for sustaining a mesopelagic food web","Frontiers in Marine Science","","","","","","2019","2022-12-16 19:26:41","2022-12-16T19:26:41Z","","","","508","6","","","","","","","","","","","","","","","","","Accession Number: CCE LTER Contribution #0440; AR2019 Type: 10.3389/fmars.2019.00508","","","","CCE; Published","","","","","","","","","","","","","","","","","","","","","","","","","","","","","","","","","","","","","","","","","","","","","","",""
"ZEGKE6UY","journalArticle","2019","Gaskell, D. E.","Zooglider-based measurements of planktonic foraminifera in the California Currrent System","Journal of Foraminiferal Research","","","","https://urldefense.com/v3/__https://doi.org/10.2113/gsjfr.49.4.390__;!!Mih3wA!TIxBg1YeDlzeudIr0oPjTeSLeodmL844cEatr4iXGtRyAqBABOo358yp-JLs4dc$","","2019","2022-12-16 19:26:41","2022-12-16T19:26:41Z","","390-404","","","49","","","","","","","","","","","","","","","","","Accession Number: CCE LTER Contribution #0457; AR2020 Type: 10.2113/gsjfr.49.4.390","","","","CCE; Published","","","","","","","","","","","","","","","","","","","","","","","","","","","","","","","","","","","","","","","","","","","","","","",""
"URQ8M56S","journalArticle","2018","Thompson, A. R.","State of the California Current 2017–18: Still Not Quite Normal in the North and Getting Interesting in the South","CalCOFI Reports","","","","","","2018","2022-12-16 19:26:41","2022-12-16T19:26:41Z","","1-66","","","59","","","","","","","","","","","","","","","","","Accession Number: CCE LTER Contribution #0445; AR2019","","","","CCE; Published","","","","","","","","","","","","","","","","","","","","","","","","","","","","","","","","","","","","","","","","","","","","","","",""
"Y6WT69JE","thesis","2019","Carrière-Garwood, Jessica; Franks, Peter","Transport in Internal Waves with a Background Flow: Lessons Learned from Robotic Larval Mimics","","","","","","","2019","2022-12-16 19:26:41","2022-12-16T19:26:41Z","","","","","","","","","","","","","University of California","San Diego, CA","","","Ph.D.","","","","","Accession Number: CCE LTER Contribution #0465; AR2020 Volume: Ph.D.","","","","CCE; Published","","","","","","","","","","","","","","","","","","","","","","","","","","","","","","","","","","","","","","","","","","","","","","",""
"GHAYQXHP","journalArticle","2018","Santora, J. A.","Submarine canyons represent an essential habitat network for krill hotspots in a Large Marine Ecosystem","Scientific Reports","","","","","Submarine canyon systems are ubiquitous features of marine ecosystems, known to support high levels of biodiversity. Canyons may be important to benthic-pelagic ecosystem coupling, but their role in concentrating plankton and structuring pelagic communities is not well known. We hypothesize that at the scale of a large marine ecosystem, canyons provide a critical habitat network, which maintain energy fow and trophic interactions. We evaluate canyon characteristics relative to the distribution and abundance of krill, critically important prey in the California Current Ecosystem. Using a geological database, we conducted a census of canyon locations, evaluated their dimensions, and quantifed functional relationships with krill hotspots (i.e., sites of persistently elevated abundance) derived from hydro-acoustic surveys. We found that 76% of krill hotspots occurred within and adjacent to canyons. Most krill hotspots were associated with large shelf-incising canyons. Krill hotspots and canyon dimensions displayed similar coherence as a function of latitude and indicate a potential regional habitat network. The latitudinal migration of many fsh, seabirds and mammals may be enhanced by using this canyon-krill network to maintain foraging opportunities. Biogeographic assessments and predictions of krill and krill-predator distributions under climate change may be improved by accounting for canyons in habitat models.","2018","2022-12-16 19:26:41","2022-12-16T19:26:41Z","","7579","","1","8","","","","","","","","","","","","","","","","","Accession Number: CCE LTER Contribution #0413; AR2018 Type: 10.1038/s41598-018-25742-9","","","","CCE; Published","","","","","","","","","","","","","","","","","","","","","","","","","","","","","","","","","","","","","","","","","","","","","","",""
"VMW2LK2P","journalArticle","2018","Stukel, M. R.","The role of subduction and gravitational sinking in particle export, carbon sequestration, and the remineralization length scale in the California Current Ecosystem","Limnol. Oceanogr.","","","","","","2018","2022-12-16 19:26:41","2022-12-16T19:26:41Z","","363-383","","","63","","","","","","","","","","","","","","","","","Accession Number: CCE LTER Contribution #0383; AR2017,FRII2017 Type: 10.1002/lno.10636","","","","CCE; Published","","","","","","","","","","","","","","","","","","","","","","","","","","","","","","","","","","","","","","","","","","","","","","",""
"A47NKRV5","journalArticle","2018","Nickels, C. F.","The morphology of euphausiid mandibles used to assess selective predation by blue whales in the southern sector of the California Current System","Journal of Crustacean Biology","","","","","","2018","2022-12-16 19:26:41","2022-12-16T19:26:41Z","","563-573","","5","38","","","","","","","","","","","","","","","","","Accession Number: CCE LTER Contribution #0421; AR2019 Type: 10.1093/jcbiol/ruy062","","","","CCE; Published","","","","","","","","","","","","","","","","","","","","","","","","","","","","","","","","","","","","","","","","","","","","","","",""
"EQPBFQ2Z","journalArticle","2018","Ohman, M. D.","Zooglider: An autonomous vehicle for optical and acoustic sensing of zooplankton","Limnol. Oceanogr.: Methods","","","","","We present the design and preliminary results from ocean deployments of Zooglider, a new autonomous zooplankton-sensing glider. Zooglider is a modified Spray glider that includes a low-power camera (Zoocam) with telecentric lens and a custom dual frequency Zonar (200 and 1000 kHz). The Zoocam quantifies zooplankton and marine snow as they flow through a defined volume inside a sampling tunnel. Images are acquired on average every 5 cm from a maximum operating depth of ~ 400 m to the sea surface. Biofouling is mitigated using a dual approach: an ultraviolet light-emitting diode and a mechanical wiper. The Zonar permits differentiation of large and small acoustic backscatterers in larger volumes than can be sampled optically. Other sensors include a pumped conductivity, temperature, and depth unit and chlorophyll a fluorometer. Zooglider enables fully autonomous in situ measurements of mesozooplankton distributions, together with the three-dimensional orientation of organisms and marine snow in relation to other biotic and physical properties of the ocean water column. It is well suited to resolve thin layers and microscale ocean patchiness. Battery capacity supports 50 d of operations. Zooglider includes two-way communications via Iridium, permitting near-real–time transmission of data from each dive profile, as well as interactive instrument control from remote locations for adaptive sampling.","2018","2022-12-16 19:26:41","2022-12-16T19:26:41Z","","","","","","","","","","","","","","","","","","","","","","Accession Number: CCE LTER Contribution #0430; AR2019 Type: 10.1002/lom3.10301","","","","CCE; Published","","","","","","","","","","","","","","","","","","","","","","","","","","","","","","","","","","","","","","","","","","","","","","",""
"5F76G9LV","journalArticle","2018","Lévy, M.","The role of submesoscale currents in structuring marine ecosystems","Nature Communications","","","","","","2018","2022-12-16 19:26:41","2022-12-16T19:26:41Z","","","","1","9","","","","","","","","","","","","","","","","","Accession Number: CCE LTER Contribution #0448; AR2019 Type: Review, 10.1038/s41467-018-07059-3","","","","CCE; Published","","","","","","","","","","","","","","","","","","","","","","","","","","","","","","","","","","","","","","","","","","","","","","",""
"UTRS8LJP","journalArticle","2018","Biard T., J. W. Krause","The significance of giant Phaeodarians (Rhizaria) to biogenic silica export in the California Current Ecosystem","Global Biogeochemical Cycles","","","","https://urldefense.com/v3/__https://doi.org/10.1029/2018GB005877__;!!Mih3wA!TIxBg1YeDlzeudIr0oPjTeSLeodmL844cEatr4iXGtRyAqBABOo358ypDUHzQtw$","In marine ecosystems, many planktonic organisms precipitate biogenic silica (bSiO2) to build silicified skeletons. Among them, giant siliceous rhizarians (>500 μm), including Radiolaria and Phaeodaria, are important contributors to oceanic carbon pools but little is known about their contribution to the marine silica cycle. We report the first analyses of giant phaeodarians to bSiO2 export in the California Current Ecosystem. We measured the silica content of single rhizarian cells ranging in size from 470 to 3,920 μm and developed allometric equations to predict silica content (0.37–43.42 μg Si/cell) from morphometric measurements. Using sediment traps to measure phaeodarian fluxes from the euphotic zone on four cruises, we calculated bSiO2 export produced by two families, the Aulosphaeridae and Castanellidae. Biogenic silica export ranged from <0.01 to 0.63 mmol Si · m 2 · day 1. These two families alone contributed on average 10% (range 0–80%) of total bSiO2 export from the euphotic zone. Their proportional contributions increased substantially in more oligotrophic regions with lower bSiO2 fluxes. Using the in situ Underwater Vision Profiler 5, we characterized vertical distributions of the giant phaeodarian family Aulosphaeridae to a depth of 500 m and inferred their contribution to bSiO2 export in deeper waters. We found a significant increase of Aulosphaeridae export (<0.01 to 2.82 mmol Si · m 2 · day 1) when extended to mesopelagic depths. Using a global data set of in situ profiles, we estimated the significance of Aulosphaeridae to bSiO2 export and revealed that they can act as major exporters of bSiO2 to the mesopelagic zone in various regions.","2018","2022-12-16 19:26:41","2022-12-16T19:26:41Z","","987-1004","","","32","","","","","","","","","","","","","","","","","Accession Number: CCE LTER Contribution #0406; RR2018 Type: 10.1029/2018GB005877","","","","CCE; Published","","","","","","","","","","","","","","","","","","","","","","","","","","","","","","","","","","","","","","","","","","","","","","",""
"IH9KXM9P","thesis","2017","Nickels, C.; Ohman, Mark","The co-location of blue whales and their euphausiid prey across multiple spatial scales","","","","","","","2017","2022-12-16 19:26:41","2022-12-16T19:26:41Z","","","","","","","","","","","","","University of California","San Diego, CA","","","Ph.D","","","","","Accession Number: CCE LTER Contribution #0394; RR2018,AR2018","","","","CCE","","","","","","","","","","","","","","","","","","","","","","","","","","","","","","","","","","","","","","","","","","","","","","",""
"WCNC4U3C","thesis","2017","Brandon, J.; Ohman, Mark","The distribution of suspended microplastics and nanoplastics in the Northeast Pacific and their effects on zooplankton consumers","","","","","","","2017","2022-12-16 19:26:41","2022-12-16T19:26:41Z","","","","","","","","","","","","","University of California","San Diego, CA","","","Ph.D.","","","","","Accession Number: CCE LTER Contribution #0395; AR2018 Volume: Ph.D.","","","","CCE; Plastics","","","","","","","","","","","","","","","","","","","","","","","","","","","","","","","","","","","","","","","","","","","","","","",""
"URUSQ48J","journalArticle","2016","Newman, M.","The Pacific Decadal Oscillation, revisited","Journal of Climate","","","","","","2016","2022-12-16 19:26:41","2022-12-16T19:26:41Z","","4399-4427","","","29","","","","","","","","","","","","","","","","","Accession Number: CCE LTER Contribution #0372; AR2016 Type: 10.1175/JCLI-D-15-0508.1","","","","CCE; Published","","","","","","","","","","","","","","","","","","","","","","","","","","","","","","","","","","","","","","","","","","","","","","",""
"SAQCADHM","journalArticle","2016","McClatchie, S.","State of the California Current 2015–16:  Comparisons with the 1997–98 EL NIÑO","CalCOFI Reports","","","","https://urldefense.com/v3/__http://calcofi.org/ccpublications/ccreports/calcofi-reports-toc/610-crtoc-vol-57-2016.html__;!!Mih3wA!TIxBg1YeDlzeudIr0oPjTeSLeodmL844cEatr4iXGtRyAqBABOo358ypV_Vre0Q$","Warm conditions in the North Pacific in 2014–15 were a result of the continuation of the North Pacific marine heat wave, a large area of exceptionally high SST anomalies that originated in the Gulf of Alaska in late 2013. The North Pacific heat wave interacted with an El Niño developing in the equatorial Pacific in 2015. Weekly periods of exceptionally high temperature anomalies (>2˚C) occurred until the start of the El Niño (winter of 2015), when SSTs were still high but not as high as those due to the marine heat wave. During the 2015–16 El Niño, the depth of the 26.0 kg m–3 isopycnal (d26.0) was considerably shallower than during the 1982–83 and 1997–98 events. The area affected by the marine heat wave and the 2015–16 El Niño in the mixed layer was comparable to the 1997–98 El Niño, but lasted longer. Water column stratification in the upper 100 m during 2015–16 was as strong as the most extreme values during the 1997–98 El Niño. This stratification was primarily driven by the warming of the upper 100 m. Despite notable perturbations, the effects of the 2015– 16 El Niño on hydrographic properties in the CalCOFI domain were not as strong as those observed during the 1997–98 El Niño. Warm ocean conditions, stratification, nutrient suppression, and silicic acid stress likely favored initiation of a toxic Pseudo-nitzschia bloom in fall 2014. Very low zooplankton displacement volumes were associated with anomalously warm and saline surface waters off Baja California. In contrast, during the 1997–98 El Niño, zooplankton volume was near average. Off California, pelagic red crab (Pleuroncodes planipes) adults were abundant in the water column and frequently washed up on beaches of southern California from January 2015 into 2016, and central California by September 2015. Glider measurements of integrated transport up to June 2015 did not detect anomalous northward advection. As expected, HF radar indicated northward surface currents along the central California coast in fall and winter 2015–16. Northward advection appeared to be much stronger during the 1997–98 El Niño. Throughout 2015–16, the zooplankton community on the Oregon shelf was dominated by lipid-poor tropical and sub-tropical copepods and gelatinous zooplankton, indicating poor feeding conditions for small fishes that are prey for juvenile salmon. The presence of rarely encountered species increased copepod species richness during 2015–16 to levels higher than the 1998 El Niño. We infer that the unusual copepod vagrants of 2015–16 originated from an offshore and southwesterly source; an important difference from the southerly origin of vagrants during the 1997–98 El Niño. The very warm conditions caused sardine spawning to shift from central California to Oregon. Mesopelagic fish assemblage off southern California exhibited higher  abundances of species with southern affinities, and lower abundances of species with northern affinities. Forage fish (Pacific herring, northern anchovy, and Pacific sardine) were much less abundant in 2015–16 compared to previous years. In contrast, catches of salmon were close to average off northern California. Catches of young-ofthe- year rockfishes were high off central California, but low off both northern and southern California. Seabirds at Southeast Farallon Island in 2015 exhibited reduced breeding populations, reduced breeding success, lower chick growth rates, and lower fledging weights. Common murres were negatively affected in central and northern California, but seabird responses were species-specific. It is clear from the results presented here that the warm anomaly effects on the ecosystem were complicated, regionally specific, and that we do not fully understand them yet.","2016","2022-12-16 19:26:41","2022-12-16T19:26:41Z","","5-62","","","57","","","","","","","","","","","","","","","","","Accession Number: CCE LTER Contribution #0376; AR2017,FRII2017,RR2018","","","","CCE; Published","","","","","","","","","","","","","","","","","","","","","","","","","","","","","","","","","","","","","","","","","","","","","","",""
"G4RB3CVY","journalArticle","2015","Taylor, A. G.","Temporal and spatial patterns of microbial community biomass and composition in the southern California Current Ecosystem","Deep-Sea Research II","","","","https://urldefense.com/v3/__http://dx.doi.org/10.1016/j.dsr2.2014.02.006__;!!Mih3wA!TIxBg1YeDlzeudIr0oPjTeSLeodmL844cEatr4iXGtRyAqBABOo358ypHyzW550$","As partoftheCaliforniaCurrentEcosystemLongTermEcologicalResearch(CCE-LTER)Program,samples for epifluorescence microscopyand flow cytometry(FCM)werecollectedatten ‘cardinal’ stations onthe California CooperativeOceanicFisheriesInvestigations(CalCOFI)gridduring25quarterlycruisesfrom 2004to2010toinvestigatethebiomass,compositionandsize–structure ofmicrobialcommunities within thesouthernCCE.Basedonourresults,wedividedtheregionintooffshore,andinshorenorthern and southernzones.Mixed-layerphytoplanktoncommunitiesintheoffshorehadlowerbiomass (1672 μg C L 1; allerrorsrepresentthe95%confidence interval),smallersize-classcellsandbiomass wasmorestableoverseasonalcycles.Offshorephytoplanktonbiomasspeakedduringthewinter months. Mixed-layerphytoplanktoncommunitiesinthenorthernandsoutherninshorezoneshad higher biomass(78722 and3279 μg C L 1, respectively),largersize-classcellsandstrongerseasonal biomass patterns.Inshorecommunitieswereoftendominatedbymicro-size(20–200 μm) diatoms; however,autotrophicdinoflagellatesdominatedduringlate2005toearly2006,correspondingtoayear of delayedupwellinginthenorthernCCE.Biomasstrendsinmidanddeepeuphoticzonesampleswere similar tothoseseeninthemixed-layer,butwithdecliningbiomasswithdepth,especiallyforlargersize classes intheinshoreregions.Mixed-layerratiosofautotrophiccarbontochlorophyll a (AC:Chl a) hada mean valueof51.575.3. Variabilityofnitraclinedepth,bin-averagedAC:Chl a in themixed-layerranged from 40to80andfrom22to35forthedeepeuphoticzone,bothwithsignificant positiverelationships to nitraclinedepth.Totallivingmicrobialcarbon,includingauto-andheterotrophs,consistentlycom- prised abouthalfofparticulateorganiccarbon(POC).","2015","2022-12-16 19:26:41","2022-12-16T19:26:41Z","","117-128","","","112","","","","","","","","","","","","","","","","","Accession Number: CCE LTER Contribution #0239; AR2015 Edition: 18 February 2014 Type: 10.1016/j.dsr2.2014.02.006","","","","Aug_CalCOFI; CALCOFI; CCE; Published","","","","","","","","","","","","","","","","","","","","","","","","","","","","","","","","","","","","","","","","","","","","","","",""
"7L7UMVCJ","journalArticle","2015","Stukel, M. R.","Using Lagrangian-based process studies to test satellite algorithms of vertical carbon flux in the eastern North Pacific Ocean","J. Geophys. Res. Oceans","","","","","The biological carbon pump is responsible for the transport of  5–20 Pg C yr21 from the surface into the deep ocean but its variability is poorly understood due to an incomplete mechanistic understanding of the complex underlying planktonic processes. In fact, algorithms designed to estimate carbon export from satellite products incorporate fundamentally different assumptions about the relationships between plankton biomass, productivity, and export efficiency. To test the alternate formulations of export efficiency in remotesensing algorithms formulated by Dunne et al. (2005), Laws et al. (2011), Henson et al. (2011), and Siegel et al. (2014), we have compiled in situ measurements (temperature, chlorophyll, primary production, phytoplankton biomass and size structure, grazing rates, net chlorophyll change, and carbon export) made during Lagrangian process studies on seven cruises in the California Current Ecosystem and Costa Rica Dome. A food-web based approach formulated by Siegel et al. (2014) performs as well or better than other empirical formulations, while simultaneously providing reasonable estimates of protozoan and mesozooplankton grazing rates. By tuning the Siegel et al. (2014) algorithm to match in situ grazing rates more accurately, we also obtain better in situ carbon export measurements. Adequate representations of food-web relationships and grazing dynamics are therefore crucial to improving the accuracy of export predictions made from satellite– derived products. Nevertheless, considerable unexplained variance in export remains and must be explored before we can reliably use remote sensing products to assess the impact of climate change on biologically mediated carbon sequestration.","2015","2022-12-16 19:26:41","2022-12-16T19:26:41Z","","7208–7222","","","120","","","","","","","","","","","","","","","","","Accession Number: CCE LTER Contribution #0343; AR2016 Type: 10.1002/2015JC011264","","","","CCE; Published","","","","","","","","","","","","","","","","","","","","","","","","","","","","","","","","","","","","","","","","","","","","","","",""
"GXHZW9E7","journalArticle","2015","Leising, A. W.","The state of the California Current, 2014-15: Impacts of the warm-water ""blob""","CalCOFI Reports","","","","","","2015","2022-12-16 19:26:41","2022-12-16T19:26:41Z","","31-68","","","56","","","","","","","","","","","","","","","","","Accession Number: CCE LTER Contribution #0365; AR2016","","","","CALCOFI; CCE; Datazoo 078; Published","","","","","","","","","","","","","","","","","","","","","","","","","","","","","","","","","","","","","","","","","","","","","","",""
"F6K6P3J2","journalArticle","2015","Krause, J. W.","Variability in diatom contributions to biomass, organic matter production and export across a frontal gradient in the California Current Ecosystem","Journal of Geophysical Research - Oceans","","","","","","2015","2022-12-16 19:26:41","2022-12-16T19:26:41Z","","1032-1047","","2","120","","","","","","","","","","","","","","","","","Accession Number: CCE LTER Contribution #0329; AR2015 Edition: 20 Feb 2015 Type: 10.1002/2014JC010472","","","","CCE; P1106; Process_cruise; Published","","","","","","","","","","","","","","","","","","","","","","","","","","","","","","","","","","","","","","","","","","","","","","",""
