"TGA2K527","journalArticle","2014","Taniguchi, D. A. A.","Planktonic biomass size spectra: an emergent property of size-dependent physiological rates, food web dynamics, and nutrient regimes","Mar. Ecol. Prog. Series","","","","https://urldefense.com/v3/__http://www.int-res.com/articles/meps2014/514/m514p013.pdf__;!!Mih3wA!TIxBg1YeDlzeudIr0oPjTeSLeodmL844cEatr4iXGtRyAqBABOo358ypPVkKUA4$","The systematic change in a trait with size is a concise means of representing the diversity and organization of planktonic organisms. Using this simplifying principle, we investigated how interactions between trophic levels, resource concentration, and physiological rates structure the planktonic community. Specifically, we used 3 size-structured nutrient-phytoplankton- zooplankton models differing in their trophic interactions, ranging from herbivorous grazing on one size class to omnivorous grazing on multiple size classes. We parameterized our models based on an extensive review of the literature. The maximum phytoplankton growth, maximum microzooplankton grazing, and phytoplankton half-saturation constant were found to vary inversely with size, and the nutrient half-saturation constant scaled positively with size. We examined the emergent community structure in our models under 4 nutrient regimes: 10, 20, 25, and 30 μM total N. In all models under all nutrient conditions, the normalized biomass of both phytoplankton and microzooplankton decreased with increasing size. As nutrients were in creased, phytoplankton biomass was added to larger size classes with little change in the extant smaller size classes; for microzooplankton, spectra elongated and biomass was added to all size classes. The different grazing behaviors among models led to more subtle changes in the community structure. Overall, we found that phytoplankton are top-down controlled and microzooplankton are largely bottomup controlled. Sensitivity analyses showed that both phytoplankton and microzooplankton biomass vary strongly with the size-dependence of the maximum grazing rate. Therefore, this parameter must be known with the greatest accuracy, given its large influence on the emergent community spectra.","2014","2022-12-16 19:26:41","2022-12-16T19:26:41Z","","13-33","","","514","","","","","","","","","","","","","","","","","Accession Number: CCE LTER Contribution #0302; AR2015 Type: 10.3354/meps10968","","","","CCE; Published","","","","","","","","","","","","","","","","","","","","","","","","","","","","","","","","","","","","","","","","","","","","","","",""
"MAJBEGHI","journalArticle","2014","Kuhnz, L. A.","Rapid changes and long-term cycles in the benthic megafaunal community observed over 24 years in the abyssal northeast Pacific","Progress in Oceanography","","","","","The abyssal seafloor community in the NE Pacific (Station M,  4000 m depth) was studied between 2006 and 2012 using remotely operated vehicles (ROVs) as part of a continuing 24-year time-series study. New patterns continue to emerge showing that the deep-sea can be dynamic on short time scales, rather than static over long periods. In just over 2 years the community shifted from a sessile, suspension-feeding, sponge-dominated community to a mobile, detritus-feeding, sea cucumber-dominated assemblage. In 2006 megafaunal diversity (Simpson’s Diversity Index, SDI) was high, yet the community was depauperate in terms of density compared to later periods. Over an 18-month period beginning in spring 2011, the densities of mobile organisms increased by nearly an order of magnitude while diversity decreased below 2006 levels. In late 2012 four sea cucumbers (two Peniagone spp., Elpidia sp. A, and Scotoplanes globosa) were at the highest densities recorded since investigations began at Station M in 1989. For a group of 10 echinoderms investigated over the entire study period, we saw evidence of a long-term cycle spanning 2 decades. These changes can be tied to a variable food supply originating in shallow water. Large variations over decadal-scales indicate that remote abyssal communities are dynamic and likely subject to impacts from anthropogenic changes like ocean warming, acidification, and pollution manifested in the upper ocean. The degree of dynamism indicates that one-time or short-term investigations are not sufficient for assessing biological community structure in conservation or exploitation studies in the deep sea.","2014","2022-12-16 19:26:41","2022-12-16T19:26:41Z","","1-11","","","124","","","","","","","","","","","","","","","","","Accession Number: CCE LTER Contribution #0349; AR2016 Type: 10.1016/j.pocean.2014.04.007","","","","CCE; Published; Sta M","","","","","","","","","","","","","","","","","","","","","","","","","","","","","","","","","","","","","","","","","","","","","","",""
"3HJN6LGB","journalArticle","2014","Landry, M. R.","On database biases and hypothesis testing with dilution experiments:  Response to Comment by Latasa","Limnology and Oceanography","","","","","","2014","2022-12-16 19:26:41","2022-12-16T19:26:41Z","","1095-1096","","3","59","","","","","","","","","","","","","","","","","Accession Number: CCE LTER Contribution #0291; AR2015 Type: 10.4319/lo.2014.59.3.1095","","","","CCE; Published","","","","","","","","","","","","","","","","","","","","","","","","","","","","","","","","","","","","","","","","","","","","","","",""
"I49VYTIY","journalArticle","2013","Wilson, S. E.","Seasonal and inter-annual contribution of zooplankton fecal pellets to carbon flux in the abyssal northeast Pacific","Limnology and Oceanography","","","","","","2013","2022-12-16 19:26:41","2022-12-16T19:26:41Z","","881-892","","3","58","","","","","","","","","","","","","","","","","Accession Number: CCE LTER Contribution #0191 Type: 10.4319/lo.2013.58.3.0881","","","","CCE; Published","","","","","","","","","","","","","","","","","","","","","","","","","","","","","","","","","","","","","","","","","","","","","","",""
"DDEWA9GZ","journalArticle","2014","Goldstein, M. C.","Relationship of diversity and habitat area in North Pacific plastic‑associated rafting communities","Marine Biology","","","","https://urldefense.com/v3/__http://link.springer.com/article/10.1007/s00227-014-2432-8__;!!Mih3wA!TIxBg1YeDlzeudIr0oPjTeSLeodmL844cEatr4iXGtRyAqBABOo358ypSEmFmgM$","Plastic and other anthropogenic debris (e.g., rubber, tar) augment natural floating substrates (e.g., algal rafts, pumice) in the open ocean, allowing “islands” of substrate-associated organisms to persist in an otherwise unsuitable habitat. We examined a total of 242 debris objects collected in the eastern Pacific in 2009 and 2011 (32–39°N, 130–142°W) and the western Pacific in 2012 (19–41°N, 143–156°E). Here, we ask: (a) What taxa are associated with plastic rafts in the North Pacific? and (b) Does the number of taxa associated with plastic debris vary with the size of the debris “island?” We documented 95 rafting taxa from 11 phyla. We identified several potentially invasive plastic-associated rafting taxa, including the coral pathogen Halofolliculina spp. In concordance with classic species–area curves, the number of rafting taxa was positively correlated with the size of the raft. Our findings suggest that diversity patterns on plastic debris are compatible with the concept of island biogeography.","2014","2022-12-16 19:26:41","2022-12-16T19:26:41Z","","1441-1453","","6","161","","","","","","","","","","","","","","","","","Accession Number: CCE LTER Contribution #0267; AR2015 Edition: 13 April 2014 ISBN: 0025-3162 Type: 10.1007/s00227-014-2432-8","","","","CCE; Published","","","","","","","","","","","","","","","","","","","","","","","","","","","","","","","","","","","","","","","","","","","","","","",""
"36ZW5RT8","journalArticle","2013","Whitney, F. A.","Nutrient enrichment of the subarctic Pacific Ocean pycnocline","Geophysical Research Letters","","","","","","2013","2022-12-16 19:26:41","2022-12-16T19:26:41Z","","2200 - 2205","","10","40","","","","","","","","","","","","","","","","","Accession Number: CCE LTER Contribution #0192 Edition: 30 May 2013 Type: 10.1002/grl.50439","","","","CCE; Published","","","","","","","","","","","","","","","","","","","","","","","","","","","","","","","","","","","","","","","","","","","","","","",""
"ZPF4LAD4","report","2013","Sydeman, W. J.","Seabirds on the CalCOFI/CCE-LTER Surveys, 2012:  Annual Data Report","","","","","","","2013","2022-12-16 19:26:41","2022-12-16T19:26:41Z","","16","","","","","","","","","","","FIAER","Petaluma, CA","","","","","","","","Accession Number: CCE LTER Contribution #0274 Publication Title: FIAER Annual Data Report","","","","CCE; CalCOFI; Published","","","","","","","","","","","","","","","","","","","","","","","","","","","","","","","","","","","","","","","","","","","","","","",""
"NJTTIHSC","journalArticle","2013","Putrasahan, D. A.; Miller, A. J.; Seo, H.","Regional coupled ocean–atmosphere downscaling in the Southeast Pacific: impacts on upwelling, mesoscale air–sea fluxes, and ocean eddies","Ocean Dynamics","","","","https://urldefense.com/v3/__http://dx.doi.org/10.1007/s10236-013-0608-2__;!!Mih3wA!TIxBg1YeDlzeudIr0oPjTeSLeodmL844cEatr4iXGtRyAqBABOo358yplyvsHJo$","","2013","2022-12-16 19:26:41","2022-12-16T19:26:41Z","","463-488","","5","63","","","","","","","","","","English","","","","","","","Accession Number: CCE LTER Contribution #0232 ISBN: 1616-7341 Type: 10.1007/s10236-013-0608-2","","","","CCE; Coupled ocean–atmosphere feedbacks; Eastern boundary current; Humboldt Current; Mesoscale eddies; Peru current; Published; Surface fluxes; VOCALS","","","","","","","","","","","","","","","","","","","","","","","","","","","","","","","","","","","","","","","","","","","","","","",""
"4D8EZG5W","thesis","2013","Powell, J. R.; Ohman, Mark","Ocean fronts in the Southern California Current System and their role in structuring zooplankton distributions, diel vertical migration, and size composition","","","","","","","2013","2022-12-16 19:26:41","2022-12-16T19:26:41Z","","","","","","","","","","","","","University of California","San Diego","","","Ph.D.","","","","","Accession Number: CCE LTER Contribution #0258 Pages: 190 Volume: Ph.D.","","","","CCE; P0605; P0704; P0810; PhD_thesis; Process_cruise; Published","","","","","","","","","","","","","","","","","","","","","","","","","","","","","","","","","","","","","","","","","","","","","","",""
"4U6BYGVR","bookSection","2013","Laney, C. M.; Baker, K. S.; Peters, D. P. C.; Ramsey, K. W.","Recommendations for Data Accessibility","Long-Term Trends in Ecological Systems: A Basis for Understanding Responses to Global Change","","","","","","2013","2022-12-16 19:26:41","2022-12-16T19:26:41Z","","216-225","","","Technical Bulletin No. 1931","","","","","","","","U.S. Department of Agriculture","Washington, D.C.","","1","","","","","","Accession Number: CCE LTER Contribution #0149","","","","CCE; Published","","Peters, D. P. C.","","","","","","","","","","","","","","","","","","","","","","","","","","","","","","","","","","","","","","","","","","","","",""
"DZDFELJL","journalArticle","2013","Goldstein, M. C.","Scales of spatial heterogeneity of plastic marine debris in the northeast Pacific Ocean","PLOS ONE","","","","","Plastic debris has been documented in many marine ecosystems, including remote coastlines, the water column, the deep sea, and subtropical gyres. The North Pacific Subtropical Gyre (NPSG), colloquially called the ‘‘Great Pacific Garbage Patch,’’ has been an area of particular scientific and public concern. However, quantitative assessments of the extent and variability of plastic in the NPSG have been limited. Here, we quantify the distribution, abundance, and size of plastic in a subset of the eastern Pacific (approximately 20–40uN, 120–155uW) over multiple spatial scales. Samples were collected in Summer 2009 using surface and subsurface plankton net tows and quantitative visual observations, and Fall 2010 using surface net tows only. We documented widespread, though spatially variable, plastic pollution in this portion of the NPSG and adjacent waters. The overall median microplastic numerical concentration in Summer 2009 was 0.448 particles m22 and in Fall 2010 was 0.021 particles m22, but plastic concentrations were highly variable over the submesoscale (10 s of km). Size-frequency spectra were skewed towards small particles, with the most abundant particles having a cross-sectional area of approximately 0.01 cm2. Most microplastic was found on the sea surface, with the highest densities detected in low-wind conditions. The numerical majority of objects were small particles collected with nets, but the majority of debris surface area was found in large objects assessed visually. Our ability to detect high-plastic areas varied with methodology, as stations with substantial microplastic did not necessarily also contain large visually observable objects. A power analysis of our data suggests that high variability of surface microplastic will make future changes in abundance difficult to detect without substantial sampling effort. Our findings suggest that assessment and monitoring of oceanic plastic debris must account for high spatial variability, particularly in regards to the evaluation of initiatives designed to reduce marine debris.","2013","2022-12-16 19:26:41","2022-12-16T19:26:41Z","","e80020","","11","8","","","","","","","","","","","","","","","","","Accession Number: CCE LTER Contribution #0269 Type: 10.1371/journal.pone.0080020","","","","CCE; NPSG; Published; Seaplex","","","","","","","","","","","","","","","","","","","","","","","","","","","","","","","","","","","","","","","","","","","","","","",""
"XHVNBKHK","journalArticle","2012","Sydeman, W. J.","Seabirds and climate change: roadmap for the future","Marine Ecology Progress Series","","","","","","2012","2022-12-16 19:26:41","2022-12-16T19:26:41Z","","107-117","","","454","","","","","","","","","","","","","","","","","Accession Number: CCE LTER Contribution #0280 Type: 10.3354/meps09806","","","","CCE; CalCOFI; Published","","","","","","","","","","","","","","","","","","","","","","","","","","","","","","","","","","","","","","","","","","","","","","",""
"4QWJDH54","journalArticle","2012","Suryan, R. M.; Santora, J. A.; Sydeman, W. J.","New approach for using remotely sensed chlorophyll a to identify seabird hotspots","Marine Ecology Progress Series","","","","https://urldefense.com/v3/__http://www.int-res.com/abstracts/meps/v451/p213-225/__;!!Mih3wA!TIxBg1YeDlzeudIr0oPjTeSLeodmL844cEatr4iXGtRyAqBABOo358ypp3DKe9w$","","2012","2022-12-16 19:26:41","2022-12-16T19:26:41Z","","213-225","","","451","","","","","","","","","","","","","","","","","Accession Number: CCE LTER Contribution #0204 Type: 10.3354/meps09597","","","","CCE; Published","","","","","","","","","","","","","","","","","","","","","","","","","","","","","","","","","","","","","","","","","","","","","","",""
"MX663HAG","journalArticle","2012","Landry, M. R.; Ohman, M. D.; Goericke, R.; Stukel, M. R.; Barbeau, K. A.; Bundy, R. M.; Kahru, M.","Pelagic community responses to a deep-water front in the California Current Ecosystem: overview of the A-Front Study","Journal of Plankton Research","","","","https://urldefense.com/v3/__http://plankt.oxfordjournals.org/content/early/2012/04/24/plankt.fbs025.abstract__;!!Mih3wA!TIxBg1YeDlzeudIr0oPjTeSLeodmL844cEatr4iXGtRyAqBABOo358yptCMcdwg$","In October 2008, we investigated pelagic community composition and biomass, from bacteria to fish, across a sharp frontal gradient overlying deep waters south of Point Conception, California. This north–south gradient, which we called A-Front, was formed by the eastward flow of the California Current and separated cooler mesotrophic waters of coastal upwelling origin to the north, from warm oligotrophic waters of likely mixed subarctic–subtropical origin to the south. Plankton biomass and phytoplankton growth rates were two to three times greater on the northern side, and primary production rates were elevated 5-fold to the north. Compared with either of the adjacent waters, the frontal interface was strongly enriched and uniquely defined by a subsurface bloom of large diatoms, elevated concentrations of suspension-feeding zooplankton, high bioacoustical estimates of pelagic fish and enhanced bacterial production and phytoplankton biomass and photosynthetic potential. Such habitats, though small in areal extent, may contribute disproportionately and importantly to regional productivity, nutrient cycling, carbon fluxes and trophic ecology. As a general introduction to the A-Front study, we provide an overview of its design and implementation, a brief summary of major findings and a discussion of potential mechanisms of plankton enrichment at the front.","2012","2022-12-16 19:26:41","2022-12-16T19:26:41Z","","739-748","","9","34","","","","","","","","","","","","","","","","","Accession Number: CCE LTER Contribution #0207 Type: 10.1093/plankt/fbs025","","","","CCE; Datazoo 181; P0810; Process_cruise; Published","","","","","","","","","","","","","","","","","","","","","","","","","","","","","","","","","","","","","","","","","","","","","","",""
"4X3N4DIG","journalArticle","2012","Chenillat, F.; Rivière, P.; Capet, X.; Di Lorenzo, E.; Blanke, B.","North Pacific Gyre Oscillation modulates seasonal timing and ecosystem functioning in the California Current upwelling system","Geophysical Research Letters","","","","https://urldefense.com/v3/__http://dx.doi.org/10.1029/2011GL049966__;!!Mih3wA!TIxBg1YeDlzeudIr0oPjTeSLeodmL844cEatr4iXGtRyAqBABOo358ypY1pqCNc$","","2012","2022-12-16 19:26:41","2022-12-16T19:26:41Z","","L01606","","1","39","","","","","","","","","","","","","","","","","Accession Number: CCE LTER Contribution #0279 ISBN: 1944-8007 Type: 10.1029/2011GL049966","","","","4215 Climate and interannual variability; 4279 Upwelling and convergences; 4815 Ecosystems, structure, dynamics, and modeling; CCE; California upwelling system; Published; ecosystem; numerical modeling; seasonal variability","","","","","","","","","","","","","","","","","","","","","","","","","","","","","","","","","","","","","","","","","","","","","","",""
"2NUMX3E4","journalArticle","2012","King, A. L.; Buck, K. N.; Barbeau, K. A.","Quasi-Lagrangian drifter studies of iron speciation and cycling off Point Conception, California","Marine Chemistry","","","","https://urldefense.com/v3/__http://pubget.com/paper/pgtmp_4aad3739a676e510042242ffe820853c__;!!Mih3wA!TIxBg1YeDlzeudIr0oPjTeSLeodmL844cEatr4iXGtRyAqBABOo358ypWTtW3kA$  https://urldefense.com/v3/__http://www.sciencedirect.com/science/article/pii/S0304-4203(11)00126-5__;!!Mih3wA!TIxBg1YeDlzeudIr0oPjTeSLeodmL844cEatr4iXGtRyAqBABOo358yph272Yl0$","The distribution and speciation of dissolved Fe (dFe) were measured during four quasi-Lagrangian drogued drifter studies (~4d duration each) that were conducted in the southern California Current System in May 2006 and April 2007. Three of the four drifter studies were within the coastal upwelling regime and one drifter study was in a warm-core anticyclonic eddy. Incubation bottle experiments were also conducted to determine the degree of phytoplankton Fe limitation and to assess changes in the concentration of Fe-binding ligands. In the coastal upwelling drifter studies, in situ dFe (1.4–1.8nM) and macronutrients were initially high and declined over time. Fe addition incubation experiments indicated that the phytoplankton community was not Fe limited at the beginning of the coastal upwelling drifter experiments (when μM nitrate:nM dFe ratios were ~7–8). By the end of two of the three drifter studies (when μM nitrate:nM dFe ratios were ~12–19), Fe addition resulted in larger nitrate and silicic acid drawdown, and larger accumulations in chlorophyll a, particulate organic carbon and nitrogen, and diatom and dinoflagellate-specific carotenoid pigments. Fe speciation was measured in situ in three of the four drifter studies with stronger L1-type ligands found to be present in excess of dFe in all samples. In Fe speciation incubation experiments, L1-type ligand production was observed in conjunction with phytoplankton growth under Fe-limiting conditions. The results presented here support and add a quasi-Lagrangian perspective to previous observations of dFe and macronutrient cycling over space and time within the California coastal upwelling regime, including Fe limitation within the phytoplankton community in this region and the biological production of Fe-binding ligands concomitant with Fe limitation.","2012","2022-12-16 19:26:41","2022-12-16T19:26:41Z","","1-12","","","128-129","","","","","","","","","","eng","","","","Pubget","","","Accession Number: CCE LTER Contribution #0197 ISBN: 0304-4203 Type: 10.1016/j.marchem.2011.11.001","","","","CCE; Datazoo 181; P0605; P0704; Process_cruise; Published","","","","","","","","","","","","","","","","","","","","","","","","","","","","","","","","","","","","","","","","","","","","","","",""
"S2RSFUAZ","journalArticle","2012","Condon, R. H.","Recurrent jellyfish blooms are a consequence of global oscillations","Proceedings of the National Academy of Sciences of the United States of America","","","","https://urldefense.com/v3/__http://www.pnas.org/cgi/doi/10.1073/pnas.1210920110__;!!Mih3wA!TIxBg1YeDlzeudIr0oPjTeSLeodmL844cEatr4iXGtRyAqBABOo358ypmBKNHXA$","A perceived recent increase in global jellyfish abundance has been portrayed as a symptom of degraded oceans. This perception is based primarily on a few case studies and anecdotal evidence, but a formal analysis of global temporal trends in jellyfish populations has been missing. Here, we analyze all available long-term datasets on changes in jellyfish abundance across multiple coastal stations, using linear and logistic mixed models and effect-size analysis to showthat there is norobust evidence for a global increase in jellyfish. Although there has been a small linear increase in jellyfish since the 1970s, this trend was unsubstantiated by effect-size analysis that showed no difference in the proportion of increasing vs. decreasing jellyfish populations over all time periods examined. Rather, the strongest nonrandom trend indicated jellyfish populations undergo larger, worldwide oscillations with an approximate 20-y periodicity, including a rising phase during the 1990s that contributed to the perception of a global increase in jellyfish abundance. Sustained monitoring is required over the next decade to elucidate with statistical confidence whether the weak increasing linear trend in jellyfish after 1970 is an actual shift in the baseline or part of an oscillation. Irrespective of the nature of increase, given the potential damage posed by jellyfish blooms to fisheries, tourism, and other human industries, our findings foretell recurrent phases of rise and fall in jellyfish populations that society should be prepared to face.","2012","2022-12-16 19:26:41","2022-12-16T19:26:41Z","","1000-1005","","3","110","","","","","","","","","","","","","","","","","Accession Number: External data user #1 Type: 10.1073/pnas.1210920110","","","","Aug_CalCOFI; CCE; Datazoo ?; External_data_user; Published","","","","","","","","","","","","","","","","","","","","","","","","","","","","","","","","","","","","","","","","","","","","","","",""
"MP3XA29X","journalArticle","2012","Booth, J. A. T.; McPhee-Shaw, E. E.; Chua, P.; Kingsley, E.; Denny, M.; Phillips, R.; Bograd, S. J.; Zeidberg, L. D.; Gilly, W. F.","Natural intrusions of hypoxic, low pH water into nearshore marine environments on the California coast","Continental Shelf Research","","","","https://urldefense.com/v3/__http://www.sciencedirect.com/science/article/pii/S0278434312001653__;!!Mih3wA!TIxBg1YeDlzeudIr0oPjTeSLeodmL844cEatr4iXGtRyAqBABOo358ypFUf0l3k$","","2012","2022-12-16 19:26:41","2022-12-16T19:26:41Z","","108-115","","0","45","","","","","","","","","","","","","","","","","Accession Number: CCE LTER Contribution #0193 ISBN: 0278-4343 Type: https://urldefense.com/v3/__http://dx.doi.org/10.1016/j.csr.2012.06.009__;!!Mih3wA!TIxBg1YeDlzeudIr0oPjTeSLeodmL844cEatr4iXGtRyAqBABOo358ypJM3eznM$","","","","CCE; Coastal ecosystems; Hypoxia; Internal tides; Oxygen; Published; Upwelling; pH","","","","","","","","","","","","","","","","","","","","","","","","","","","","","","","","","","","","","","","","","","","","","","",""
