"FJ4JD9TF","journalArticle","2015","Miller, A. J.","The physical oceanographic environment during the CCE-LTER Years: Changes in climate and concepts","Deep-Sea Research II","","","","https://urldefense.com/v3/__http://dx.doi.org/10.1016/j.dsr2.2014.01.003__;!!Mih3wA!TIxBg1YeDlzeudIr0oPjTeSLeodmL844cEatr4iXGtRyAqBABOo358ypns-hoC4$","The CaliforniaCurrentSystem(CCS)hasbeenstudiedbytheCaliforniaCooperativeOceanicFisheries Investigationsprogramformanydecades.Since2004,theSouthernCaliforniaBight(SCB)andthe oceanic regionoffshorehasalsobeenthesitefortheCaliforniaCurrentEcosystem(CCE)Long-Term Ecological Research(LTER)program,whichhasestablishedlong-termobservationaltimeseriesand executedseveralProcessCruisestobetterunderstandphysical–biological variations, fluxesand interactions.SincetheinceptionoftheCCE-LTER,manynewideashaveemergedaboutwhatphysical processes arethekeycontrolsonCCSdynamics.Thesenewperspectivesincludeobtainingabetter understanding ofwhatclimatepatternsexertinfluences onCCSphysicalvariationsandwhatphysical controls aremostimportantindrivingCCEecologicalchanges. PhysicaloceanographicandclimatologicalconditionsintheCCSvariedwidelysincetheinceptionof the CCE-LTERobservationaltimeseries,includingunusualclimateeventsandpersistentlyanomalous states. AlthoughtheCCE-LTERprojectcommencedin2004inthemidstofnormaloceanconditionsnear the climatologicalmeans,overthefollowingdecade,ElNino/SouthernOscillationconditions flickered weaklyfromwarmtocold,withthePacific DecadalOscillation(PDO)generallytrackingthatbehavior, while theNorthPacific GyreOscillation(NPGO)evolvedtopersistentandstrongpositiveconditionsafter 2007,indicativeofenhancedupwellingfrom2007to2012.Togetherthecombinedimpactofthe negativePDOstate(LaNinaconditions)andpositiveNPGOstate(increasedupwellingconditions) yielded remarkablypersistentcoolconditionsintheCCSfromlate2007toearly2009andfrommid- 2010through2012. The broad-scaleclimatevariationsthatoccurredovertheNorthPacific andCCSduringthistime period arediscussedheretoprovidephysicalcontextfortheCCE-LTERtimeseriesobservationsandthe CCE-LTERProcessCruises.Dataassimilation fits, usingtheRegionalOceanModelingSystemfour- dimensional dataassimilationframework,weresuccessfullyexecutedforthe1-monthtimeperiod surrounding eachoftheProcessCruises.The fits provideadditionalinformationabouthowthephysical flowsevolveduringthecourseofthemulti-weekProcessCruises.Relatingthesephysicalstatestothe numerous biologicalmeasurementsgatheredbytheCCE-LTERtimeseriesobservationsandduringthe Process Cruiseswillyieldvitallong-termperspectiveofhowchangingclimateconditionscontrolthe ocean ecosysteminthisregionandinformationonhowthisimportantecosystemcanbeexpectedto evolveoverthecomingdecades.","2015","2022-12-16 19:26:41","2022-12-16T19:26:41Z","","6-17","","","112","","","","","","","","","","","","","","","","","Accession Number: CCE LTER Contribution #0284; AR2015 Type: 10.1016/j.dsr2.2014.01.003","","","","CALCOFI; CCE; P0605; P0704; P0810; P1208; Process_cruise; Published","","","","","","","","","","","","","","","","","","","","","","","","","","","","","","","","","","","","","","","","","","","","","","",""
"6XU2LDB8","journalArticle","2015","Laguionie‑Marchais, C.","Spatial and temporal variation in sponge spicule patches at Station M, northeast Pacific","Marine Biology","","","","","","2015","2022-12-16 19:26:41","2022-12-16T19:26:41Z","","617-624","","","162","","","","","","","","","","","","","","","","","Accession Number: CCE LTER Contribution #0353; AR2016 Type: 10.1007/s00227-014-2609-1","","","","CCE; Published; Supplement; sta M","","","","","","","","","","","","","","","","","","","","","","","","","","","","","","","","","","","","","","","","","","","","","","",""
"3RA9NXD5","journalArticle","2015","Jacox, M. G.","The potential for improving remote primary productivity estimates through subsurface chlorophyll and irradiance measurement","Deep-Sea Research II","","","","https://urldefense.com/v3/__http://dx.doi.org/10.1016/j.dsr2.2013.12.008__;!!Mih3wA!TIxBg1YeDlzeudIr0oPjTeSLeodmL844cEatr4iXGtRyAqBABOo358yp6xEQEgY$","A 26-yearrecordofdepthintegratedprimaryproductivity(PP)intheSouthernCaliforniaCurrentSystem (SCCS) isanalyzedwiththegoalofimprovingsatellitenetprimaryproductivity(PP)estimates.Modest improvementsinPPmodelperformanceareachievedbytuningexistingalgorithmsfortheSCCS, particularlybyparameterizingcarbon fixation rateintheverticallygeneralizedproductionmodelasa function ofsurfacechlorophyllconcentrationanddistancefromshore.Muchlargerimprovementsare enabled byimprovingtheaccuracyofsubsurfacechlorophyllandlightprofiles. Inasimplevertically resolvedproductionmodelfortheSCCS(VRPM-SC),substitutionof in situ surface dataforremotesensing estimates offersonlymarginalimprovementsinmodel r2 (from 0.54to0.56)andtotallog10 rootmean squareddifference(from0.22to0.21),whileinclusionof in situ chlorophyllandlightprofiles improves these metricsto0.77and0.15,respectively.Autonomousunderwatergliders,capableofmeasuring subsurface propertiesonlong-term,long-rangedeployments,significantly improvePPmodel fidelity in the SCCS.Wesuggesttheiruse(andthatofotherautonomousprofilers suchasArgo floats) in conjunction withsatellitesasawayforwardforlarge-scaleimprovementsinPPestimation.","2015","2022-12-16 19:26:41","2022-12-16T19:26:41Z","","107-116","","","112","","","","","","","","","","","","","","","","","Accession Number: CCE LTER Contribution #0237; AR2015 Edition: 17 December 2013 Type: 10.1016/j.dsr2.2013.12.008","","","","Aug_CalCOFI; CALCOFI; CCE; P0605; P0704; P0810; P1106; P1208; Process_cruise; Published","","","","","","","","","","","","","","","","","","","","","","","","","","","","","","","","","","","","","","","","","","","","","","",""
"QXE9KMDQ","journalArticle","2015","Jackson, G. A.","Settling of particles in the upper 100m of the ocean detected with autonomous profiling floats off California","Deep Sea Research I","","","","","","2015","2022-12-16 19:26:41","2022-12-16T19:26:41Z","","75-86","","","99","","","","","","","","","","","","","","","","","Accession Number: CCE LTER Contribution #0325; AR2015 Type: https://urldefense.com/v3/__http://dx.doi.org/10.1016/j.dsr.2015.02.001__;!!Mih3wA!TIxBg1YeDlzeudIr0oPjTeSLeodmL844cEatr4iXGtRyAqBABOo358ypuM6WuOU$","","","","CCE; P0704; Published","","","","","","","","","","","","","","","","","","","","","","","","","","","","","","","","","","","","","","","","","","","","","","",""
"9BYUKN82","journalArticle","2015","Johnston, T. M. S. and D. L. Rudnick","Trapped diurnal internal tides, propagating semidiurnal internal tides, and mixing estimates in the California Current System from sustained glider observations, 2006-2012","Deep -Sea Research II","","","","https://urldefense.com/v3/__http://dx.doi.org/10.1016/j.dsr2.2014.03.009__;!!Mih3wA!TIxBg1YeDlzeudIr0oPjTeSLeodmL844cEatr4iXGtRyAqBABOo358yp-xFM8Ns$","From2006–2012,along3repeatedcross-shoretransects(CaliforniaCooperativeOceanicFisheriesInvestiga- tionslines66.7,80,and90)intheCaliforniaCurrentSystem,33609shearand39737strainprofiles from 66glidermissionsareusedtoestimatemixingvia finescaleparameterizationsfromadatasetcontaining over52000profiles.Elevateddiffusivityestimatesandenergeticdiurnal(D1) andsemidiurnal(D2) internal tidesarefound:(a)within100kmofthecoastonlines66.7and80and(b)overtheSantaRosa-CortesRidge (SRCR)intheSouthernCaliforniaBight(SCB)online90.While findingelevatedmixingneartopographyand associatedwithinternaltidesisnotnovel,thecombinationofresolutionandextentinthisongoingdata collection isunmatchedinthecoastaloceantoourknowledge. Both D1 and D2 internal tidesareenergysourcesformixing.Attheselatitudes,the D1 internal tideis subinertial. Online90, D1 and D2 tides areequallyenergeticovertheSRCR,themainsiteofelevated mixing withintheSCB.NumeroussourcesofinternaltidesattheroughtopographyintheSCBproduce standing and/orpartially-standingwaves.Onlines66.7and80,thedominantenergysourcebelowabout 100mformixingisthe D1 internal tide,whichhasanenergydensityofthe D2 internal tide.Online80, estimated diffusivity,estimateddissipation,and D1 energy densitypeakinsummer.The D1 energy density showsanincreasingtrendfrom2006to2012.Itsamplitudeandphasearemostlyconsistent with topographically-trapped D1 internal tidestravelingwiththetopographyontheirright.The observed offshoredecayofthediffusivityestimatesisconsistentwiththeexponentialdecayof a trappedwavewithamode-1Rossbyradiusof20–30 km.Despitethevariablemesoscale,itis remarkablethatcoherentinternaltidalphaseisfound.","2015","2022-12-16 19:26:41","2022-12-16T19:26:41Z","","61-78","","","112","","","","","","","","","","","","","","","","","Accession Number: CCE LTER Contribution #0249; AR2015 Edition: 18 March 2014 Type: 10.1016/j.dsr2.2014.03.009","","","","CCE; Published","","","","","","","","","","","","","","","","","","","","","","","","","","","","","","","","","","","","","","","","","","","","","","",""
"8NIJA378","journalArticle","2015","Garcia-Reyes, M.","Under pressure: Climate change, upwelling and eastern boundary upwelling ecosystems","Frontiers in Marine Science","","","","","","2015","2022-12-16 19:26:41","2022-12-16T19:26:41Z","","","","","2:109","","","","","","","","","","","","","","","","","Accession Number: CCE LTER Contribution #0362; AR2016 Type: 10.3389/fmars.2015.00109","","","","CCE; Published","","","","","","","","","","","","","","","","","","","","","","","","","","","","","","","","","","","","","","","","","","","","","","",""
"PS9QACQY","journalArticle","2014","Taniguchi, D. A. A.","Size-specific growth and grazing rates for picophytoplankton in coastal and oceanic regions of the eastern Pacific","Mar. Ecol. Prog. Series","","","","","Estimates of growth and grazing mortality rates for different size classes and taxa of natural picophytoplankton assemblages were measured in mixed-layer experiments conducted in 3 regions of the eastern Pacific: the California Current Ecosystem, Costa Rica Dome, and equatorial Pacific. Contrary to expectation, size-dependent rates for cells between 0.45 and 4.0 μm in diameter showed no systematic trends with cell size both in and among regions. For all size classes, mean ± SD growth rates ranged from −0.70 ± 0.17 to 0.83 ± 0.13 d−1 and grazing rates between −0.07 ± 0.13 and 1.17 ± 0.10 d−1. Taxon-specific growth rates for Prochlorococcus ranged from 0.17 ± 0.12 to 0.59 ± 0.01 d−1, for Synechococcus from 0.68 ± 0.03 to 0.97 ± 0.04 d−1, for picoeukaryotes from 0.46 ± 0.13 to 1.03 ± 0.06 d−1, and for all cells combined between 0.45 ± 0.03 and 0.65 ± 0.02 d−1. For grazing, Prochlorococcus rates ranged between 0.02 ± 0.12 and 0.66 ± 0.02 d−1, Synechococcus rates between 0.24 ± 0.08 and 0.92 ± 0.05 d−1, for picoeukaryotes between 0.19 ± 0.10 and 0.78 ± 0.09 d−1, and for all cells between 0.16 ± 0.05 and 0.75 ± 0.02 d−1. When comparing rates among taxa, only Prochlorococcus had consistently lower rates than Synechococcocus in all regions. No other trends were apparent. Temperature relationships based on the Metabolic Theory of Ecology were able to explain more of the variability among grazing rates than among growth rates for each taxon considered.","2014","2022-12-16 19:26:41","2022-12-16T19:26:41Z","","87-101","","","509","","","","","","","","","","","","","","","","","Accession Number: CCE LTER Contribution #0255; AR2015 Type: 10.3354/meps10895","","","","CCE; P0605; Process_cruise; Published","","","","","","","","","","","","","","","","","","","","","","","","","","","","","","","","","","","","","","","","","","","","","","",""
"SWU4QM6E","journalArticle","2014","Pedler, B.","Single bacterial strain capable of significant contribution to carbon cycling in the surface ocean","PNAS","","","","https://urldefense.com/v3/__http://www.pnas.org/cgi/doi/10.1073/pnas.1401887111__;!!Mih3wA!TIxBg1YeDlzeudIr0oPjTeSLeodmL844cEatr4iXGtRyAqBABOo358yp5pmeYss$","","2014","2022-12-16 19:26:41","2022-12-16T19:26:41Z","","7202-7207","","20","111","","","","","","","","","","","","","","","","","Accession Number: CCE LTER Contribution #0251; AR2015 Edition: 14 April 2014 Type: 10.1073/pnas.1401887111","","","","CALCOFI; CCE; Datazoo 78; P0810; Published","","","","","","","","","","","","","","","","","","","","","","","","","","","","","","","","","","","","","","","","","","","","","","",""
"M75TW545","journalArticle","2014","Bograd, S. J.","The fate of fisheries oceanography: Introduction to the special issue","Oceanography","","","","https://urldefense.com/v3/__http://dx.doi.org/10.5670/oceanog.2014.83__;!!Mih3wA!TIxBg1YeDlzeudIr0oPjTeSLeodmL844cEatr4iXGtRyAqBABOo358ypv4g-1rg$","","2014","2022-12-16 19:26:41","2022-12-16T19:26:41Z","","21-25","","4","27","","","","","","","","","","","","","","","","","Accession Number: CCE LTER Contribution #0321; AR2015","","","","CCE; Published","","","","","","","","","","","","","","","","","","","","","","","","","","","","","","","","","","","","","","","","","","","","","","",""
"DI9WCMRX","journalArticle","2013","Wells, B.; J. Harding, J. Field; R. Bradley, J. Jahncke; S. R. Schneider, N. Lo","State of the California Current 2012-13: No Such Thing as an “Average” Year","CalCOFI Reports","","","","","This report reviews the state of the California Current System (CCS) between winter 2012 and spring 2013, and includes observations from Washington State to Baja California. During 2012, large-scale climate modes indicated the CCS remained in a cool, productive phase present since 2007. The upwelling season was delayed north of 42˚N, but regions to the south, especially 33˚ to 36˚N, experienced average to above average upwelling that persisted throughout the summer. Contrary to the indication of high production suggested by the climate indices, chlorophyll observed from surveys and remote sensing was below average along much of the coast. As well, some members of the forage assemblages along the coast experienced low abundances in 2012 surveys. Specifically, the concentrations of all lifestages observed directly or from egg densities of Pacific sardine, Sardinops sagax, and northern anchovy, Engraulis mordax, were less than previous years’ survey estimates. However, 2013 surveys and observations indicate an increase in abundance of northern anchovy. During winter 2011/2012, the increased presence of northern copepod species off northern California was consistent with stronger southward transport. Krill and small-fraction zooplankton abundances, where examined, were generally above average. North of 42˚N, salps returned to typical abundances in 2012 after greater observed concentrations in 2010 and 2011. In contrast, salp abundance off central and southern California increased after a period of southward transport during winter 2011/2012. Reproductive success of piscivorous Brandt’s cormorant, Phalacrocorax penicillatus, was reduced while planktivorous Cassin’s auklet, Ptychoramphus aleuticus was elevated. Differences between the productivity of these two seabirds may be related to the available forage assemblage observed in the surveys. California sea lion pups from San Miguel Island were undernourished resulting in a pup mortality event perhaps in response to changes in forage availability. Limited biological data were available for spring 2013, but strong winter upwelling coastwide indicated an early spring transition, with the strong upwelling persisting into early summer.","2013","2022-12-16 19:26:41","2022-12-16T19:26:41Z","","37-71","","","54","","","","","","","","","","","","","","","","","Accession Number: CCE LTER Contribution #0300","","","","CALCOFI; CCE; Published","","","","","","","","","","","","","","","","","","","","","","","","","","","","","","","","","","","","","","","","","","","","","","",""
"DYDRGUZS","journalArticle","2013","Roe, K. L.","Utilization of heme as an iron source by marine Alphaproteobacteria in the Roseobacter clade","Applied and Environmental Microbiology","","","","","","2013","2022-12-16 19:26:41","2022-12-16T19:26:41Z","","5753-5762","","18","79","","","","","","","","","","","","","","","","","Accession Number: CCE LTER Contribution #0273 Edition: July 19, 2013 Type: 10.1128/AEM.01562-13","","","","CCE; P1106; Process_cruise; Published","","","","","","","","","","","","","","","","","","","","","","","","","","","","","","","","","","","","","","","","","","","","","","",""
"X2DV4JDT","journalArticle","2013","Peloquin, J.","The MAREDAT global database of high performance liquid chromatography marine pigment measurements","Earth System Science Data","","","","","","2013","2022-12-16 19:26:41","2022-12-16T19:26:41Z","","109-123","","","5","","","","","","","","","","","","","","","","","Accession Number: CCE LTER Contribution #0244 Type: 10.5194/essd-5-109-2013","","","","Aug_CalCOFI; CCE; Datazoo 72; Published","","","","","","","","","","","","","","","","","","","","","","","","","","","","","","","","","","","","","","","","","","","","","","",""
"QE4ZXUID","journalArticle","2013","Dolan, J. R.; Landry, M. R.; Ritchie, M. E.","The species-rich assemblages of tintinnids (marine planktonic protists) are structured by mouth size","ISME J","","","","https://urldefense.com/v3/__http://dx.doi.org/10.1038/ismej.2013.23__;!!Mih3wA!TIxBg1YeDlzeudIr0oPjTeSLeodmL844cEatr4iXGtRyAqBABOo358ypyOxHElU$","","2013","2022-12-16 19:26:41","2022-12-16T19:26:41Z","","1237-1243","","6","7","","","","","","","","","","","","","","","","","Accession Number: CCE LTER Contribution #0254 ISBN: 1751-7362 Type: Original Article, 10.1038/ismej.2013.23","","","","CCE; P0810; Process_cruise; Published; biodiversity; ciliate; rare species; species packing; tintinnida","","","","","","","","","","","","","","","","","","","","","","","","","","","","","","","","","","","","","","","","","","","","","","",""
"KTLTZH7K","journalArticle","2013","Di Lorenzo, E.","Synthesis of Pacific Ocean Climate and Ecosystem Dynamics","Oceanography","","","","https://urldefense.com/v3/__http://dx.doi.org/10.5670/oceanog.2013.76__;!!Mih3wA!TIxBg1YeDlzeudIr0oPjTeSLeodmL844cEatr4iXGtRyAqBABOo358yp1CzGFG4$","","2013","2022-12-16 19:26:41","2022-12-16T19:26:41Z","","68-81","","4","26","","","","","","","","","","","","","","","","","Accession Number: CCE LTER Contribution #0286 Type: 10.5670/oceanog.2013.76","","","","CCE; Published","","","","","","","","","","","","","","","","","","","","","","","","","","","","","","","","","","","","","","","","","","","","","","",""
"B52ABDXN","journalArticle","2012","Taylor, A. G.","Sharp gradients in phytoplankton community structure across a frontal zone in the California Current Ecosystem","Journal of Plankton Research","","","","","Spatial variability of plankton biomass, community composition and size structure was investigated across a strong frontal transition (A-Front) in the southern California Current Ecosystem in October 2008. Depth profiles were taken across a 25-km transect of nine stations sampled semi-synoptically during one night and for 3 days following drifter arrays in the adjacent water masses. Community compositions are compared based on analyses by digital epifluorescence microscopy, flow cytometry and pigment composition by high-pressure liquid chromatography. Our results show three assemblages sharply delineated in space, with plankton at the front being compositionally distinct and biomass elevated relative to either of the adjacent water masses. Depth-averaged chlorophyll a (Chl a) varied by a factor of 2.3 (0.35–0.81 mg Chl a L21) and autotrophic carbon (AC) varied almost 3-fold (13.6–35.4 mg C L21) across the front. One of the most striking features was a sharp gradient in the distribution of Prochlorococcus (PRO) and Synechococcus (SYN), with PRO located in the warmer oligotrophic waters on the south side of the front and SYN located in the cooler mesotrophic waters to the north. Both PRO and SYN had local biomass minima directly at the front. The peak in phytoplankton biomass at the front was dominated by large (.20 mm) diatom cells, comprising 71% of the total community biomass. In contrast to previous studies of frontal features in the southern California Current, our study of the A-Front shows strong frontal enhancement of phytoplankton biomass and a shift of phytoplankton size structure towards larger cells.","2012","2022-12-16 19:26:41","2022-12-16T19:26:41Z","","778-789","","9","34","","","","","","","","","","","","","","","","","Accession Number: CCE LTER Contribution #0208 Type: 10.1093/plankt/fbs036","","","","CCE; P0810; Process_cruise; Published","","","","","","","","","","","","","","","","","","","","","","","","","","","","","","","","","","","","","","","","","","","","","","",""
"29MWJHBJ","thesis","2012","Taniguchi, D. A. A.; Franks, Michael Landry and Peter","Size structuring of planktonic communities: Biological rates and ecosystem dynamics","","","","","https://urldefense.com/v3/__https://www.dropbox.com/s/nga2ok6elpcaqpo/Taniguchi*20Dissertation*2C*20Final.pdf__;JSUl!!Mih3wA!TIxBg1YeDlzeudIr0oPjTeSLeodmL844cEatr4iXGtRyAqBABOo358ypPtIRrjs$","","2012","2022-12-16 19:26:41","2022-12-16T19:26:41Z","","","","","","","","","","","","","University of California","San Diego","","","Ph.D.","","","","","Accession Number: CCE LTER Contribution #0227 Pages: 23 Volume: Ph.D.","","","","CCE; PhD_thesis; Published Dissertations, Academic UCSD Oceanography","","","","","","","","","","","","","","","","","","","","","","","","","","","","","","","","","","","","","","","","","","","","","","",""
"MTMZ4JMA","journalArticle","2012","Linacre, L. P.","Temporal dynamics of carbon flow through the microbial plankton community in a coastal upwelling system off northern Baja California, Mexico","Marine Ecology Progress Series","","","","https://urldefense.com/v3/__http://www.int-res.com/abstracts/meps/v461/p31-46/__;!!Mih3wA!TIxBg1YeDlzeudIr0oPjTeSLeodmL844cEatr4iXGtRyAqBABOo358ypx_n_E_c$","","2012","2022-12-16 19:26:41","2022-12-16T19:26:41Z","","31-46","","","461","","","","","","","","","","","","","","","","","Accession Number: CCE LTER Contribution #0181 Type: 10.3354/meps09782","","","","CCE; Published","","","","","","","","","","","","","","","","","","","","","","","","","","","","","","","","","","","","","","","","","","","","","","",""
"IIC2H54I","journalArticle","2012","Kahru, M.; Kudela, R. l M.; Manzano-Sarabia, M.; Mitchell, B. G.","Trends in the surface chlorophyll of the California Current: Merging data from multiple ocean color satellites","Deep-Sea Research Part II","","","","https://urldefense.com/v3/__http://www.sciencedirect.com/science/article/pii/S0967064512000550__;!!Mih3wA!TIxBg1YeDlzeudIr0oPjTeSLeodmL844cEatr4iXGtRyAqBABOo358ypHVUl2M8$","","2012","2022-12-16 19:26:41","2022-12-16T19:26:41Z","","89-98","","0","77–80","","","","","","","","","","","","","","","","","Accession Number: CCE LTER Contribution #0219 ISBN: 0967-0645 Type: https://urldefense.com/v3/__http://dx.doi.org/10.1016/j.dsr2.2012.04.007__;!!Mih3wA!TIxBg1YeDlzeudIr0oPjTeSLeodmL844cEatr4iXGtRyAqBABOo358yp-KT-wSE$","","","","Aug_CalCOFI; CALCOFI; CCE; California Current; Chlorophyll; Ocean color; P0605; P0704; P0810; P1106; P1208; Phytoplankton; Published; Remote sensing","","","","","","","","","","","","","","","","","","","","","","","","","","","","","","","","","","","","","","","","","","","","","","",""
"IXGF9FXC","journalArticle","2012","Kahru, M.; Di Lorenzo, E.; Manzano-Sarabia, M.; Mitchell, B. G.","Spatial and temporal statistics of sea surface temperature and chlorophyll fronts in the California Current","Journal of Plankton Research","","","","https://urldefense.com/v3/__http://plankt.oxfordjournals.org/content/early/2012/03/01/plankt.fbs010.abstract__;!!Mih3wA!TIxBg1YeDlzeudIr0oPjTeSLeodmL844cEatr4iXGtRyAqBABOo358ypT6NIejc$","The statistics of sea-surface fronts detected with the automated histogram method were studied in the California Current using sea-surface temperature (SST) and chlorophyll-a concentration (Chl) images from various satellite sensors. Daily maps of fronts were averaged into monthly composites of front frequency (FF) spanning 29 years (1981–2009) for SST and 14 years (1997–2010) for Chl. The large-scale distributions of frontal frequency of both SST (FFsst) and of Chl (FFchl) had a 500–700 km wide band of elevated values (4–7%) along the coast that roughly coincided with the area of increased mesoscale eddy activity. FFsst and FFchl were positively correlated at monthly and seasonal frequencies, but the year-to-year variations were not significantly correlated. The long-period (1 year and longer) variability in FFsst is influenced by the large-scale SST gradient, while at shorter timescales the influence of the Coastal Upwelling Index is evident. In contrast with FFsst, FFchl variability is less related to the coherent large-scale forcing and has stronger sensitivity to local forcings in individual areas. Decadal-scale increasing trends in the frequency of both SST and Chl fronts were detected in the Ensenada Front area (general area of the A-Front study) and corresponded to, respectively, trends towards colder SST and increasing chlorophyll-a concentration.","2012","2022-12-16 19:26:41","2022-12-16T19:26:41Z","","749-760","","9","34","","","","","","","","","","","","","","","","","Accession Number: CCE LTER Contribution #0218 Type: 10.1093/plankt/fbs010","","","","Aug_CalCOFI; CALCOFI; CCE; P0605; P0704; P0810; P1106; P1208; Published","","","","","","","","","","","","","","","","","","","","","","","","","","","","","","","","","","","","","","","","","","","","","","",""
