"LS54QXM3","journalArticle","2017","Li, Q. P.","Recovering growth and grazing rates from nonlinear dilution experiments","Limnol. Oceanogr.","","","","","Biological rate measurements provide critical information for understanding key processes and modeling future states of marine ecosystems. Experimentally derived rates can be challenging to interpret when methodological assumptions are untested or potentially violated under variable natural conditions, such as the assumed linear grazing response of the dilution technique for estimating rates of phytoplankton growth and microzooplankton grazing impact. Here, we show that grazing nonlinearity can be related to the ratio of initial phytoplankton biomass to the half-saturation parameter in the Holling II model, while not being affected by varying grazer biomass during dilution experiments. From this, we present theory to recover growth and grazing rates from multi-treatment dilution experiments with nonlinear grazing results. We test our analyses with data collected during the California Current Ecosystem-Long-Term Ecological Research (CCE-LTER) program. We show that using a linear regression in 2-treatment dilution experiments may lead to underestimates of microzooplankton grazing rates, particularly in high-phytoplankton-biomass coastal regions where grazing can be saturated. Using the Holling II grazing model and a correction factor, growth and grazing rates from 2-treatment experiments can also be estimated, as illustrated by application to Lagrangian watertracking studies of growth and grazing dynamics in the CCE.","2017","2022-12-16 19:26:41","2022-12-16T19:26:41Z","","1825-1835","","5","62","","","","","","","","","","","","","","","","","Accession Number: CCE LTER Contribution #0385; AR2017,FRII2017 Type: 10.1002/lno.10536","","","","CCE; Published","","","","","","","","","","","","","","","","","","","","","","","","","","","","","","","","","","","","","","","","","","","","","","",""
"2V4XUB99","journalArticle","2017","Kahru, M.","Ocean productivity from space: Commentary","Global Biogeochem. Cycles","","","","","","2017","2022-12-16 19:26:41","2022-12-16T19:26:41Z","","","","","131","","","","","","","","","","","","","","","","","Accession Number: CCE LTER Contribution #0411; AR2018 Type: 10.1002/2016GB005582","","","","CCE; Published","","","","","","","","","","","","","","","","","","","","","","","","","","","","","","","","","","","","","","","","","","","","","","",""
"H2K3NCZQ","thesis","2017","Freibott, A.; Landry, Mike","Plankton community composition and grazing dynamics in upwelling regions of the Pacific Ocean","","","","","","","2017","2022-12-16 19:26:41","2022-12-16T19:26:41Z","","","","","","","","","","","","","University of California","San Diego, CA","","","Ph.D.","","","","","Accession Number: CCE LTER Contribution #0384; AR2017,FRII2017 Pages: 160 Volume: Ph.D.","","","","CCE; in press","","","","","","","","","","","","","","","","","","","","","","","","","","","","","","","","","","","","","","","","","","","","","","",""
"M5EYG3WL","journalArticle","2016","Ohman, M. D. and J.-B. Romagnan","Nonlinear effects of body size and optical attenuation on Diel Vertical Migration by zooplankton","Limnology and Oceanography","","","","","We adopt a trait-based approach to explain Diel Vertical Migration (DVM) across a diverse assemblage of planktonic copepods, utilizing body size as a master trait. We find a reproducible pattern of body sizedependence of day and night depths occupied, and of DVM. Both the smallest surface-dwelling and the largest deeper-dwelling copepods refrain from migrations, while intermediate-sized individuals show pronounced DVM. This pattern apparently arises as a consequence of size-dependent predation risk. In the size classes of migratory copepods the amplitude of DVM is further modulated by optical attenuation in the ocean water column because increased turbidity decreases encounter rates with visually hunting predators. Long-term changes in the ocean optical environment are expected to alter the vertical distributions of many copepods and thus to affect predator-prey encounters as well as oceanic carbon export.","2016","2022-12-16 19:26:41","2022-12-16T19:26:41Z","","765-770","","","61","","","","","","","","","","","","","","","","","Accession Number: CCE LTER Contribution #0346; AR2016 Type: 10.1002/lno.10251","","","","CCE; Process_cruise; Published","","","","","","","","","","","","","","","","","","","","","","","","","","","","","","","","","","","","","","","","","","","","","","",""
"59YKSAZM","thesis","2016","Netburn, A. N.","Responses of mesopelagic fish assemblages to environmental disturbance: ocean deoxygenation and oceanic fronts.","","","","","","","2016","2022-12-16 19:26:41","2022-12-16T19:26:41Z","","","","","","","","","","","","","University of California","San Diego, CA","","","Ph.D.","","","","","Accession Number: CCE LTER Contribution #0356; AR2016 Volume: Ph.D.","","","","","","","","","","","","","","","","","","","","","","","","","","","","","","","","","","","","","","","","","","","","","","","","","","",""
"DDI5WBM4","journalArticle","2016","McGill, P. R.","Sedimentation event sensor: New ocean instrument for in situ imaging and fluorometry of sinking particulate matter","Limnol. Oceanogr. Methods","","","","","Measuring the quantity and composition of sinking particulate matter is key to understanding biogeochemical processes in the ocean. This has been done in the past with sequencing sediment traps, which collect and store particulate matter in sample bottles for subsequent laboratory analysis. Having a limited number of bottles, these traditional traps force the user to choose between finer time resolution and longer deployment duration. We have built a new sediment trap that analyzes the collected material in situ, eliminating the need to preserve and store the samples. This new instrument, the Sedimentation Event Sensor (SES), captures macro images of the sample with front and back lighting, and takes fluorometric measurements in two bands as proxies for the presence of chlorophyll a and accessory pigments. The SES can process 6200 samples during a single deployment, which is the equivalent of 15 samples per day for more than a year. Here, we describe the design of the SES and present the results of its first three deployments at 3910 m depth. Images and fluorometry data revealed high variability of sinking particulate matter composition on the order of hours. Sedimentation patterns detected by the SES largely agreed with mass flux patterns measured from traditional traps deployed concurrently nearby. Given the functional differences, the SES is best used to complement rather than replace traditional sediment traps.","2016","2022-12-16 19:26:41","2022-12-16T19:26:41Z","","853-863","","12","14","","","","","","","","","","","","","","","","","Accession Number: CCE LTER Contribution #0386; AR2017,FRII2017 Type: 10.1002/lom3.10131","","","","CCE; Published","","","","","","","","","","","","","","","","","","","","","","","","","","","","","","","","","","","","","","","","","","","","","","",""
"A22FVL8J","journalArticle","2016","Lindegren, M.","Resilience and stability of a pelagic marine ecosystem","Proceedings of the Royal Society B","","","","https://urldefense.com/v3/__http://dx.doi.org/10.1098/rspb.2015.1931__;!!Mih3wA!TIxBg1YeDlzeudIr0oPjTeSLeodmL844cEatr4iXGtRyAqBABOo358ypGiPySFw$","","2016","2022-12-16 19:26:41","2022-12-16T19:26:41Z","","20151931","","","283","","","","","","","","","","","","","","","","","Accession Number: CCE LTER Contribution #0348; AR2016 Type: 10.1098/rspb.2015.1931","","","","CCE; Published","","","","","","","","","","","","","","","","","","","","","","","","","","","","","","","","","","","","","","","","","","","","","","",""
"SWUXFCWG","journalArticle","2016","Jacox, M. G.","Optimal environmental conditions and anomalous ecosystem responses: constraining bottom-up controls of phytoplankton biomass in the California Current System","Nature Scientific Reports","","","","","","2016","2022-12-16 19:26:41","2022-12-16T19:26:41Z","","","","","6:27612","","","","","","","","","","","","","","","","","Accession Number: CCE LTER Contribution #0363; AR2016 Type: 10.1038/srep27612","","","","CCE; Published","","","","","","","","","","","","","","","","","","","","","","","","","","","","","","","","","","","","","","","","","","","","","","",""
"5ERHEVI8","journalArticle","2015","Santora, J. A.","Persistence of hotspots and variability of seabird species richness and abundance in the southern California Current","Ecosphere","","","","https://urldefense.com/v3/__http://dx.doi.org/10.1890/ES14-00434.1__;!!Mih3wA!TIxBg1YeDlzeudIr0oPjTeSLeodmL844cEatr4iXGtRyAqBABOo358ypXMLqS6o$","Aggregations of seabirds at sea may provide information on centers of enhanced trophic interactions and concentrating mechanisms, however, to date most studies lack quantification of persistence, a key hotspot characteristic. Persistence statistics may reduce uncertainty about seabird habitat use, improve understanding of the spatio-temporal scales of pelagic food web dynamics, and inform conservation planning. Using 26 years (1987–2012, 47 surveys) of shipboard surveys from a 300K km2 study area within the southern California Current Ecosystem, we conduct a spatial assessment of the inter-annual and seasonal dynamics of the persistence of seabird hotspots and identify recurring sites of elevated seabird species richness and abundance. Previous studies document declines in abundance, but were based on broad spatial standardizations to assess where declines may have occurred. Here, we refine the hypothesis that seabird populations have declined off southern California by focusing on persistently used habitats in nearshore or offshore domains. We demonstrate that spatio-temporal variability of seabird distribution and abundance is characterized by anomalous events embedded within trends. In addition to identifying the locations of persistence of seabird aggregations, we found significant declines in species richness and the density of sooty shearwater (Puffinus griseus) and Leach’s storm petrel (Oceanodroma leucorhoa); in contrast, black-footed albatross (Phoebastria nigripes) abundance appear to be increasing. This assessment provides a spatially-explicit framework for future evaluations of biophysical drivers of seabird hotspots and their associations and impacts on forage fish and zooplankton populations.","2015","2022-12-16 19:26:41","2022-12-16T19:26:41Z","","214","","11","6","","","","","","","","","","","","","","","","","Accession Number: CCE LTER Contribution #0345; AR2016","","","","CCE; Published","","","","","","","","","","","","","","","","","","","","","","","","","","","","","","","","","","","","","","","","","","","","","","",""
"MRD4VEPA","journalArticle","2015","Rykaczewski, R. R.","Poleward displacement of coastal upwelling-favorable winds in the ocean's eastern boundary currents through the 21st century","Geophysical Research Letters","","","","","","2015","2022-12-16 19:26:41","2022-12-16T19:26:41Z","","6424-6431","","","42","","","","","","","","","","","","","","","","","Accession Number: CCE LTER Contribution #0366; AR2016 Type: 10.1002/2015GL064694","","","","CCE; Published","","","","","","","","","","","","","","","","","","","","","","","","","","","","","","","","","","","","","","","","","","","","","","",""
"4R99YLD3","bookSection","2015","Ohman, M. D.","Prologue to:  Sardet, C.  Plankton: Wonders of the Drifting World","","","","","","","2015","2022-12-16 19:26:41","2022-12-16T19:26:41Z","","224","","","","","","","","","","","University of Chicago Press","Chicago, IL","","","","","","","","Accession Number: CCE LTER Contribution #0318; AR2015","","","","CCE; Published","","","","","","","","","","","","","","","","","","","","","","","","","","","","","","","","","","","","","","","","","","","","","","",""
"A7R8FVDR","journalArticle","2015","Koslow, J. A. and J. Couture","Pacific Ocean observation programs: Gaps in ecological time series","Marine Policy","","","","https://urldefense.com/v3/__http://www.sciencedirect.com/science/article/pii/S0308597X1400236X__;!!Mih3wA!TIxBg1YeDlzeudIr0oPjTeSLeodmL844cEatr4iXGtRyAqBABOo358ypi1836Yk$","How well do existing ocean observation programs monitor the oceans through space and time? A meta-analysis of ocean observation programs in the Pacific Ocean was carried out to determine where and how key parameters defining the physics, chemistry, and biology of the oceans were measured. The analysis indicates that although the chemistry and physics of the Pacific Ocean are reasonably well monitored, ecological monitoring remains largely ad hoc, patchy, unsystematic, and inconsistent. The California Cooperative Oceanic Fisheries Investigations (CalCOFI), for example, is the only Pacific Ocean program in which the zooplankton and micronekton are resolved to species with consistent time series of greater than 20 years duration. Several studies now indicate massive changes to nearshore, mesopelagic and other fish communities of the southern California Current but available time series do not allow these potential changes to be examined more widely. Firm commitment from the global community to sustained, representative, quantitative marine observations at the species level is required to adequately assess the ecological status of the oceans.","2015","2022-12-16 19:26:41","2022-12-16T19:26:41Z","","408-414","","","51","","","","","","","","","","","","","","","","","Accession Number: CCE LTER Contribution #0310; AR2015 ISBN: 0308-597X Type: https://urldefense.com/v3/__http://dx.doi.org/10.1016/j.marpol.2014.09.003__;!!Mih3wA!TIxBg1YeDlzeudIr0oPjTeSLeodmL844cEatr4iXGtRyAqBABOo358ypTtnlcbY$","","","","CCE; Ichthyoplankton; Micronekton; Ocean observation programs; Pacific Ocean; Published; Time series; Zooplankton","","","","","","","","","","","","","","","","","","","","","","","","","","","","","","","","","","","","","","","","","","","","","","",""
"JIGL7EIT","journalArticle","2015","Kahru, M.","Optimized merger of ocean chlorophyll algorithms","IEEE Geoscience and Remote Sensing Letters","","","","","","2015","2022-12-16 19:26:41","2022-12-16T19:26:41Z","","2282-2285","","11","12","","","","","","","","","","","","","","","","","Accession Number: CCE LTER Contribution #0369; AR2016 Type: 10.1109/LGRS.2015.2470250.","","","","Aug_CalCOFI; CALCOFI; CCE; P0605; P0704; P0810; P1106; P1208; P1408; Process_cruise; Published","","","","","","","","","","","","","","","","","","","","","","","","","","","","","","","","","","","","","","","","","","","","","","",""
"5GI48668","journalArticle","2015","Jacox, M.","Sensitivity of the California Current nutrient supply to wind, heat, and remote ocean forcing","Geophys. Res. Lett.","","","","","A regional ocean model is used to evaluate the roles of wind, surface heat ﬂux, and basin-scale climate variability in regulating the upwelled nitrate supply in the California Current. A strong positive trend in nitrate ﬂux from 1980 to 2010 was driven almost entirely by enhanced equatorward winds, negating a weak negative trend associated with increased surface heat ﬂux. Increased upwelling and nitrate ﬂux are consistent with cooler surface temperatures and higher phytoplankton concentrations observed over the same period. Changes in remote ocean forcing, resulting primarily from basin-scale climate variability (e.g., El Niño–Southern Oscillation and Paciﬁc Decadal Oscillation), drive considerable interannual ﬂuctuations and may dominate the ecosystem response on interannual to decadal time scales. However, comparison with previously published ﬁndings suggests that local wind intensiﬁcation persists through changing basin-scale climate regimes. Understanding the different time scales of variability in forcing mechanisms, and their interactions with each other, is necessary to distinguish transient ecosystem impacts from secular trends.","2015","2022-12-16 19:26:41","2022-12-16T19:26:41Z","","5950-5957","","","42","","","","","","","","","","","","","","","","","Accession Number: CCE LTER Contribution #0324; AR2016 Edition: 24 July 2015 Type: 10.1002/2015GL065147","","","","CCE; Published","","","","","","","","","","","","","","","","","","","","","","","","","","","","","","","","","","","","","","","","","","","","","","",""
"58LM9STZ","journalArticle","2015","Kahru, M.","Optimized multi-satellite merger of primary production estimates in the California Current using inherent optical properties","Journal of Marine Systems","","","","https://urldefense.com/v3/__http://dx.doi.org/10.1016/j.jmarsys.2014.06.003__;!!Mih3wA!TIxBg1YeDlzeudIr0oPjTeSLeodmL844cEatr4iXGtRyAqBABOo358ypdsY55ec$","Building a multi-decadal time series of large-scale estimates of net primary production (NPP) requires merging data from multiple ocean color satellites. The primary product of ocean color sensors is spectral remote sensing reflectance (Rrs). We found significant differences (13–18% median absolute percent error) between Rrs estimates at 443 nm of different satellite sensors. These differences in Rrs are transferred to inherent optical properties and further on to estimates of NPP. We estimated NPP for the California Current region from three ocean color sensors (SeaWiFS, MODIS-Aqua and MERIS) using a regionally optimized absorption based primary production model (Aph-PP) of Lee et al. (2011). Optimization of the Aph-PP model was required for each individual satellite sensor in order to make NPP estimates from different sensors compatible with each other. While the concept of Aph-PP has advantages over traditional chlorophyll-based NPP models, in practical application even the optimized Aph-PP model explained less than 60% of the total variance in NPP which is similar to other NPP algorithms. Uncertainties in satellite Rrs estimates as well as uncertainties in parameters representing phytoplankton depth distribution and physiology are likely to be limiting our current capability to accurately estimate NPP from space. Introducing a generic vertical profile for phytoplankton improved slightly the skill of the Aph-PP model.","2015","2022-12-16 19:26:41","2022-12-16T19:26:41Z","","94-102","","","147","","","","","","","","","","","","","","","","","Accession Number: CCE LTER Contribution #0296; AR2015 Edition: 11 June 2014 Type: 10.1016/j.jmarsys.2014.06.003","","","","Aug_CalCOFI; CALCOFI; CCE; P0605; P0704; P0810; P1106; P1208; Process_cruise; Published","","","","","","","","","","","","","","","","","","","","","","","","","","","","","","","","","","","","","","","","","","","","","","",""
"RR9X9DP3","journalArticle","2015","Edwards, C. A.","Regional ocean data assimilation","Annu. Rev. Mar. Sci.","","","","","","2015","2022-12-16 19:26:41","2022-12-16T19:26:41Z","","6.1-6.22","","","7","","","","","","","","","","","","","","","","","Accession Number: CCE LTER Contribution #0328; AR2015 Type: 10.1146/annurev-marine-010814-015821","","","","CCE; Published","","","","","","","","","","","","","","","","","","","","","","","","","","","","","","","","","","","","","","","","","","","","","","",""
"C5FWBMEP","thesis","2015","de Verneil, A.; Franks, Peter","Phytoplankton in Surface Ocean Fronts: Resolving Biological Dynamics and Spatial Structure","","","","","","","2015","2022-12-16 19:26:41","2022-12-16T19:26:41Z","","","","","","","","","","","","","University of California","San Diego","","","Ph.D.","","","","","Accession Number: CCE LTER Contribution #0341; AR2016 Volume: Ph.D.","","","","CCE; In press","","","","","","","","","","","","","","","","","","","","","","","","","","","","","","","","","","","","","","","","","","","","","","",""
"TC7C7AQ2","conferencePaper","2015","Ellen, J.","Quantifying California Current Plankton Samples with Efficient Machine Learning Techniques","Proceedings of OCEANS'15 MTS/IEEE","","","","","This paper improves on the accuracy of other published machine learning results for quantifying plankton samples. The contributions of this work are: (1) Clarifying the number of expertly labeled images required for machine learning results. (2) Providing guidance as to what algorithms provide the best performance, and how to tune them. (3) Leveraging an ensemble of models to achieve recall rates beyond any single algorithm. (4) Investigating the applicability of abstaining. (5) Using size fractionation to learn more efficiently. (6) Analysis of efficacy of simple geometric features for plankton identification.","2015-10","2022-12-16 19:26:41","2022-12-16T19:26:41Z","","1-9","","","","","","","","","","","IEEE","Washington, D.C.","","","","","","","","Accession Number: CCE LTER Contribution #0344; AR2016 Type: 10.23919/OCEANS.2015.7404607","","","","CCE; Published","","","","","","","","","","","","","","","","","","","","","","","","","","","","","","","","","","","","","","","","","","","","","","",""
"8DGCDA7Z","journalArticle","2015","Chenillat, F.","Plankton dynamics in a cyclonic eddy in the Southern California Current System","Journal of Geophysical Research: Oceans","","","","https://urldefense.com/v3/__http://dx.doi.org/10.1002/2015JC010826__;!!Mih3wA!TIxBg1YeDlzeudIr0oPjTeSLeodmL844cEatr4iXGtRyAqBABOo358ypbUrVgtY$","The California Current System is an eastern boundary upwelling system (EBUS) with high biological production along the coast. Oligotrophic offshore waters create cross-shore gradients of biological and physical properties, which are affected by intense mesoscale eddy activity. The influence of eddies on ecosystem dynamics in EBUS is still in debate. To elucidate the mechanisms that influence the dynamics of ecosystems trapped in eddies, and the relative contribution of horizontal and vertical advection in determining local production, we analyze a particular cyclonic eddy using Lagrangian particle-tracking analyses of numerical Eulerian. The eddy formed in a coastal upwelling system; coastal waters trapped in the eddy enabled it to leave the upwelling region with high concentrations of plankton and nutrients. The ecosystem was initially driven mainly by recycling of biological material. As the eddy moved offshore, production in its core was enhanced compared to eddy exterior waters through Ekman pumping of nitrate from below the euphotic zone; this Ekman pumping was particularly effective due to the shallow nitracline in the eddy compared to eddy exterior waters. Both eddy trapping and Ekman pumping helped to isolate and maintain the ecosystem productivity in the eddy core. This study shows the importance of cyclonic eddies for biological production in EBUS: they contribute both to the redistribution of the coastal upwelling ecosystem and are local regions of enhanced new production. Together, these processes impact cross-shore gradients of important biological properties.","2015","2022-12-16 19:26:41","2022-12-16T19:26:41Z","","5566-5588","","","120","","","","","","","","","","","","","","","","","Accession Number: CCE LTER Contribution #0339; AR2016 Type: 10.1002/2015JC010826","","","","CCE; Published","","","","","","","","","","","","","","","","","","","","","","","","","","","","","","","","","","","","","","","","","","","","","","",""
"NMJMRFAG","journalArticle","2015","Chenillat, F.","Quantifying tracer dynamics in moving fluids: a combined Eulerian-Lagrangian approach","Front.  Environ. Sci.","","","","","","2015","2022-12-16 19:26:41","2022-12-16T19:26:41Z","","43","","","3","","","","","","","","","","","","","","","","","Accession Number: CCE LTER Contribution #0340; AR2016 Type: 10.3389/fenvs.2015.00043","","","","CCE; Published","","","","","","","","","","","","","","","","","","","","","","","","","","","","","","","","","","","","","","","","","","","","","","",""
"UVTT26L9","thesis","2015","Bresnahan, P. J.; Martz, Todd","Novel Marine Inorganic Carbon Sensors for the Anthropocene","","","","","","","2015","2022-12-16 19:26:41","2022-12-16T19:26:41Z","","","","","","","","","","","","","University of California","San Diego","","","Ph.D.","","","","","Accession Number: CCE LTER Contribution #0338; AR2016","","","","CCE; In press","","","","","","","","","","","","","","","","","","","","","","","","","","","","","","","","","","","","","","","","","","","","","","",""
